{
  "output_id": "go-fixture-1",
  "contract_id": "tc-fixture-1",
  "output_type": "full_text",
  "payload": "fixture payload",
  "self_report": {
    "changed_elements": [],
    "unchanged_elements": [],
    "added_elements": [],
    "deleted_elements": [],
    "semantic_risk_notes": [],
    "uncertainty_notes": []
  },
  "model_info": { "provider": "mock", "model": "fixture" },
  "created_at": "2026-01-01T00:00:00+00:00"
}
